Escola;Endereço;;;Dependência Administrativa;Porte da Escola;Classificação
ESC DE ENS FUND PROF ANA MARIA MONTEGGIA;Rua Atilio Supertti, 571;Vila Nova  ; 91750-200 Porto Alegre - RS;Privada; 51 e 200;2
COL JOAO PAULO I - UNIDADE SUL;Travessa Pedra Redonda, 400;Ipanema   ; 91760-630 Porto Alegre - RS;Privada; 501 e 1000;4
EMEI NOVA GLEBA;R Guido Alberto Werlang, 747;Rubem Berta  ; 91170-300 Porto Alegre - RS;Municipal; 51 e 200;2
EMEI PROTASIO ALVES;R Aracy Froes, 210;Jardim Sabara  ; 91210-230 Porto Alegre - RS;Municipal; 51 e 200;2
EMEI PADRE ANGELO COSTA;Rua Primeiro De Marco, 300;Vila Sao Jose ; 91520-620 Porto Alegre - RS;Municipal; 51 e 200;2
EMEI JARDIM CAMAQUA;R Jardim Das Bromelias, 1;Camaqua   ; 91920-400 Porto Alegre - RS;Municipal; 51 e 200;2
EMEI DA VILA MAPA II;Rua Pedro Golombiewski, 100;Lomba Do Pinheiro ; 91550-230 Porto Alegre - RS;Municipal; 51 e 200;2
EMEI DA VILA NOVA SAO CARLOS;C Estr Joao De Oliveira Remiao, 1;Lomba Do Pinheiro ; 91560-695 Porto Alegre - RS;Municipal; 51 e 200;2
EMEI PARQUE DOS MAIAS II;R Amauri Cafrune, 149;Rubem Berta  ; 91170-075 Porto Alegre - RS;Municipal; 51 e 200;2
EMEI DOS MUNICIPARIOS TIO BARNABE;R Otto Ernst Meyer, 55;Azenha   ; 90050-060 Porto Alegre - RS;Municipal; 51 e 200;2
EMEI DR WALTER SILBER;Rua Frei Clemente, 150;Vila Sao Jose ; 91520-260 Porto Alegre - RS;Municipal; 51 e 200;2
EMEI DA VILA TRONCO;Av Moab Caldas, 129;Santa Tereza  ; 90880-310 Porto Alegre - RS;Municipal; 51 e 200;2
EMEI DA VILA DA PASCOA;R Loris Jose Isatto, 0; Rubem Berta   ; 91160-160 Porto Alegre - RS;Municipal; 51 e 200;2
EMEI DA VILA NOVA RESTINGA;R Alvaro Difini, 480;Restinga   ; 91790-560 Porto Alegre - RS;Municipal; 51 e 200;2
EMEI FLORENCIA VURLOD SOCIAS;R Ten Arizoly Fagundes, 250;Restinga   ; 91790-520 Porto Alegre - RS;Municipal; 51 e 200;2
EMEI DOM LUIZ DE NADAL;R Dr Carlos Niederauer Hofmeister, 808;Restinga   ; 91790-020 Porto Alegre - RS;Municipal; 51 e 200;2
EMEI VILA NOVA;R Fernando Pessoa, 350;Vila Nova  ; 91750-340 Porto Alegre - RS;Municipal; 51 e 200;2
EMEI MARIA MARQUES FERNANDES;Av Santo Dias Da Silva, 550;Lomba Do Pinheiro ; 91550-500 Porto Alegre - RS;Municipal; 51 e 200;2
EMEI DA VILA FLORESTA;R Monte Alegre, 55;Jardim Floresta; 91040-120 Porto Alegre - RS;Municipal; 51 e 200;2
EMEI DA VILA ELIZABETH;R Paulo Gomes De Oliveira, 120; Sarandi   ; 91120-570 Porto Alegre - RS;Municipal; 51 e 200;2
EMEI VALE VERDE;Bc Franklin, 270;Jardim Sabara  ; 91210-060 Porto Alegre - RS;Municipal; 51 e 200;2
EMEI MARIA HELENA CAVALHEIRO GUSMAO;R Silvino Oliveira, 250;Vila Nova  ; 91750-057 Porto Alegre - RS;Municipal; 51 e 200;2
EMEI DA VILA MAX GEISS;R Antonio Francisco Lisboa, 400;Rubem Berta   ; 91180-040 Porto Alegre - RS;Municipal; 51 e 200;2
EMEI DO JARDIM SALOMONI;R Joaquim De Carvalho, 325; Vila Nova   ; 91740-840 Porto Alegre - RS;Municipal; 51 e 200;2
EMEI JARDIM BENTO GONCALVES;R Sargento Exped Geraldo Santana, 40;Partenon   ; 91530-640 Porto Alegre - RS;Municipal; 51 e 200;2
EMEI ERICO VERISSIMO;R Modesto Franco, 100;Passo Das Pedras ; 91230-100 Porto Alegre - RS;Municipal; 51 e 200;2
EMEI BAIRRO CAVALHADA;R Canela, 180;Cavalhada   ; 91740-190 Porto Alegre - RS;Municipal; 51 e 200;2
EMEF CAMPOS DO CRISTAL;Bc Imperio, 75;Vila Nova  ; 91750-730 Porto Alegre - RS;Municipal; 501 e 1000;4
EMEF WENCESLAU FONTOURA;R Irma Ines Favero, 1;Mario Quintana  ; 91250-095 Porto Alegre - RS;Municipal; 501 e 1000;4
EMEF VILA MONTE CRISTO;Rua Carlos Superti, 84;Vila Nova  ; 91750-020 Porto Alegre - RS;Municipal;>1000;5
EMEI PONTA GROSSA;Estr Retiro Da Ponta Grossa, 3581;Ponta Grossa  ; 91780-590 Porto Alegre - RS;Municipal; 51 e 200;2
EMEI HUMAITA;Rua Dr Caio Brandao De Mello, 1;Humaita   ; 90250-110 Porto Alegre - RS;Municipal; 51 e 200;2
EMEI DA VILA SANTA ROSA;Av Donario Braga, 1; Rubem Berta   ; 91160-360 Porto Alegre - RS;Municipal; 51 e 200;2
EMEI ILHA DA PINTADA;R Garruchos, 0;Arquipelago   ; 90090-080 Porto Alegre - RS;Municipal; 51 e 200;2
EMEF MIGRANTES;Avenida Severo Dullius, 165;Anchieta   ; 90200-310 Porto Alegre - RS;Municipal; 51 e 200;2
EMEI DA VILA VALNERI ANTUNES;Av Martim Felix Berta, 2353;Rubem Berta   ; 91270-650 Porto Alegre - RS;Municipal; 201 e 500;3
EMEF MORRO DA CRUZ;Rua Santa Teresa Vila Sao Jose Comunitaria, 541;Vila Sao Jose ; 91520-713 Porto Alegre - RS;Municipal;>1000;5
EMEF NEUSA GOULART BRIZOLA;R Monsenhor Ruben Neis, 430;Cavalhada   ; 91920-243 Porto Alegre - RS;Municipal; 201 e 500;3
COLEGIO MARISTA IPANEMA;Avenida Coronel Marcos, 1959;Ipanema   ; 91760-000 Porto Alegre - RS;Privada;>1000;5
EMEEF PROF LYGIA MORRONE AVERBUCK;R Sao Josemaria Escriva, 282;Jardim Do Salso   ; 91410-000 Porto Alegre - RS;Municipal; 51 e 200;2
EMEEF PROF ELYSEU PAGLIOLI;R Butui, 221;Cristal   ; 90820-150 Porto Alegre - RS;Municipal; 51 e 200;2
EMEEF PROF LUIZ FRANCISCO LUCENA BORGES;R Claudio Manoel Da Costa, 270;Jardim Sabara  ; 91210-250 Porto Alegre - RS;Municipal; 51 e 200;2
EMEEF TRISTAO SUCUPIRA VIANNA;Av Econ Nilo Wulff, 955;Restinga   ; 91790-000 Porto Alegre - RS;Municipal; 51 e 200;2
ESCOLA ESPECIAL PARA SURDOS FREI PACIFICO;Rua Paulino Chaves, 235;Santo Antonio  ; 90640-200 Porto Alegre - RS;Privada; 51 e 200;2
ESCOLA DE EDUCACAO ESPECIAL DO CENTRO DE REABILITACAO DE PORTO ALEGRE - CEREPAL;Rua Brigadeiro Oliveira Neri, 100;Passo Da Areia ; 90520-260 Porto Alegre - RS;Privada; 51 e 200;2
EMEI OSMAR DOS SANTOS FREITAS;Bc Um Rua Dona Otilia, 497;Santa Tereza  ; 90830-582 Porto Alegre - RS;Municipal; 51 e 200;2
ESC ENS FUND SAO FRANCISCO - SANTA FE;Avenida Delmar Rocha Barbosa, 234;Rubem Berta   ; 91180-490 Porto Alegre - RS;Privada; 51 e 200;2
EEF CRISTA DA BRASA;Avenida Florianopolis, 359;Azenha   ; 90880-460 Porto Alegre - RS;Privada; 51 e 200;2
EMEI PAULO FREIRE;Av Meridional, 0;Restinga Rua Tobago ; 91790-070 Porto Alegre - RS;Municipal; 51 e 200;2
EMEF MARIO QUINTANA;R C Vila Castelo, 1;Restinga   ; 91790-200 Porto Alegre - RS;Municipal; 501 e 1000;4
5054 EEI CASA DA CRIANCA ALGODAO DOCE;R Sao Marcos - Lomba Do Pinheiro, 150;Lomba Do Pinheiro ; 91570-380 Porto Alegre - RS;Privada; 51 e 200;2
5029 EEI CANTINHO DOS PIAS;R Thomaz Francisco De Jesus, 412;Jardim Carvalho  ; 91430-750 Porto Alegre - RS;Privada; 51 e 200;2
5049 IEI BRINCANDO DE CIRANDA;R Jose Madrid, 736;Jardim Carvalho  ; 91430-580 Porto Alegre - RS;Privada;<50;1
EEI CENTRO SOCIAL DA CRIANCA;R Augusto Comte, 80;Cavalhada   ; 91910-370 Porto Alegre - RS;Privada;<50;1
CRECHE SAO FRANCISCO DE ASSIS;Rua Alberto Torres, 194;Cidade Baixa  ; 90050-080 Porto Alegre - RS;Privada;<50;1
ESCOLA DE EDUCACAO INFANTIL TURMINHA DO BARULHO SC LTDA;Rua Waldomiro Schapke, 125;Partenon   ; 91530-390 Porto Alegre - RS;Privada;<50;1
5041 EEI MENSAGEIROS DA LUZ;Trav Cel Antonio Carneiro Pinto, 195;Petropolis   ; 90460-020 Porto Alegre - RS;Privada; 51 e 200;2
5070 IEI CENEAMM 1 DE MAIO;Estr Barcellos, 2268;Cascata   ; 91712-300 Porto Alegre - RS;Privada; 51 e 200;2
5038 IEI NOSSA SENHORA DE FATIMA -BOM JESUS;R Oito Vila Mato Sampaio, 32;Bom Jesus  ; 91420-591 Porto Alegre - RS;Privada; 51 e 200;2
5051 EEI TURMA DO BARULHO;R Tanaui Da Silva Boeira, 209;Lomba Do Pinheiro ; 91570-440 Porto Alegre - RS;Privada; 51 e 200;2
5082 IEI MEDIANEIRA;R Caixa Economica, 320;Santa Tereza  ; 90840-610 Porto Alegre - RS;Privada; 51 e 200;2
5086 EEI ARAPEI;R Arapei, 103;Cristal   ; 90830-470 Porto Alegre - RS;Privada; 51 e 200;2
5024 IEI LAR DA CRIANCA MENINO JESUS DE PRAGA;R Wolfram Metzler, 334;Rubem Berta  ; 91250-320 Porto Alegre - RS;Privada; 51 e 200;2
5069 IEI CRECHE LAR DA CRIANCA;R Nossa Senhora Do Brasil-Santa Teresa, 83;Santa Tereza  ; 90850-510 Porto Alegre - RS;Privada;<50;1
5055 IEI VOVO IDA;Rua Dona Firmina, 1583;Vila Joao Pessoa ; 91520-210 Porto Alegre - RS;Privada; 51 e 200;2
5203 EEI AMIGO GERMANO;R Santana, 1225;Farroupilha   ; 90040-372 Porto Alegre - RS;Privada; 51 e 200;2
5100 IEI ISABEL VIEIRA;Rua Nova Ipanema, 34;Hipica   ; 91755-200 Porto Alegre - RS;Privada; 51 e 200;2
5097 EEI PASSO A PASSO;Rua Morro Alto, 485;Aberta Dos Morros ; 91751-650 Porto Alegre - RS;Privada;<50;1
5019 IEI VOVO CAZEMIRO - CM CRUZEIRO;Rua Cruzeiro Do Sul, 2702;Santa Tereza  ; 90840-000 Porto Alegre - RS;Privada; 201 e 500;3
5035 EEI NOSSA SENHORA APARECIDA VILA PINTO;R J Vila Fatima-Pinto, 220;Bom Jesus  ; 91420-120 Porto Alegre - RS;Privada; 51 e 200;2
5072 IEI AMAVTRON;R Caixa Economica, 633;Santa Tereza  ; 90840-610 Porto Alegre - RS;Privada; 51 e 200;2
5182 EEI CRECHE NAVEGANTES;Av Polonia, 625;Sao Geraldo  ; 90230-110 Porto Alegre - RS;Privada; 51 e 200;2
5003 EEI ESTRELINHA DO CEU;R Ulysses De Alencastro Brandao, 205;Sarandi   ; 91140-400 Porto Alegre - RS;Privada; 51 e 200;2
5053 IEI BALAO MAGICO;Rua Rio Negro - Lomba Do Pinheiro, 59;Lomba Do Pinheiro ; 91570-330 Porto Alegre - RS;Privada; 51 e 200;2
5027 IEI GIRASSOL;R Wolfram Metzler, 567;Rubem Berta  ; 91250-320 Porto Alegre - RS;Privada; 51 e 200;2
5037 IEI AELCA;R Gen Salvador Pinheiro, 799;Vila Jardim  ; 91320-240 Porto Alegre - RS;Privada; 51 e 200;2
5021 EEI GALPAOZINHO;R Dona Beca, 120;Rubem Berta  ; 91150-000 Porto Alegre - RS;Privada; 51 e 200;2
5030 EEI TRES CORACOES;R Dezesseis Vila Mato Sampaio, 623;Bom Jesus  ; 91420-620 Porto Alegre - RS;Privada; 51 e 200;2
5007 IEI EUGENIA CONTE;Rua K, 120;Rubem Berta  ; 91160-170 Porto Alegre - RS;Privada; 51 e 200;2
EMEI MAMAE CORUJA;Av Bento Goncalves, 642;Azenha   ; 90650-000 Porto Alegre - RS;Municipal; 51 e 200;2
5013 IEI SANTA LUIZA;R Irma Maria Jose Trevisan, 30;Farrapos   ; 90250-430 Porto Alegre - RS;Privada; 51 e 200;2
5061 IEI VO BELINHA;Rua Miguel Olvicto Dos Santos, 71;Lomba Do Pinheiro ; 91550-280 Porto Alegre - RS;Privada; 51 e 200;2
5089 EEI VO MARIA;Vila Orfanotrofio Ii, 54;Nonoai   ; 90840-440 Porto Alegre - RS;Privada; 51 e 200;2
5063 IEI NOSSA SENHORA APARECIDA -VILA PINHAL;R Abacateiro, 195;Lomba Do Pinheiro ; 91560-480 Porto Alegre - RS;Privada; 51 e 200;2
5004 EEI ESTRELINHA DO AMANHA;Av Donario Braga, 159;Rubem Berta  ; 91160-360 Porto Alegre - RS;Privada; 51 e 200;2
5042 IEI PIU PIU;R Jacinto Gomes, 683;Santana   ; 90040-270 Porto Alegre - RS;Privada; 51 e 200;2
5017 EEI NEGRINHO DO PASTOREIO;R Wolfram Metzler, 21;Rubem Berta  ; 91250-320 Porto Alegre - RS;Privada; 51 e 200;2
5108 EEI PADRE PEDRO LEONARDI I;Estr Barro Vermelho, 542;Restinga   ; 91790-100 Porto Alegre - RS;Privada; 51 e 200;2
5020 EEI MADRE TERESA;R Wolfram Metzler, 605;Rubem Berta  ; 91250-320 Porto Alegre - RS;Privada; 51 e 200;2
5026 IEI CRIANCA ESPERANCA;R Joao Bravo De Almeida, 101;Sarandi   ; 91180-035 Porto Alegre - RS;Privada; 51 e 200;2
5107 EEI ARCO IRIS I;R Tobago, 1258;Restinga   ; 91790-530 Porto Alegre - RS;Privada; 51 e 200;2
5059 EEI ACOMUR;Rua Vidal De Negreiros, 996;Vila Sao Jose ; 91520-480 Porto Alegre - RS;Privada; 51 e 200;2
5056 EEI PAINEIRAS;Lg Paineiras, 477;Vila Joao Pessoa ; 91510-070 Porto Alegre - RS;Privada; 51 e 200;2
5062 IEI ESTRELA MAGICA;R Santa Catarina Estr Joao De O Remiao, 30;Lomba Do Pinheiro ; 91560-000 Porto Alegre - RS;Privada; 51 e 200;2
5223 IEI SANTA TERESINHA;Av Venancio Aires, 1030;Farroupilha   ; 90040-192 Porto Alegre - RS;Privada; 51 e 200;2
5058 EEI TOPO GIGIO;Rua Sao Jose Vila Sao Jose Comunitaria, 29;Vila Sao Jose ; 91520-470 Porto Alegre - RS;Privada; 51 e 200;2
5066 EEI MEU NENE;R Ernesto Liscano, 195;Agronomia   ; 91540-310 Porto Alegre - RS;Privada; 51 e 200;2
FILHOTINHO CENTRO DE EDUCACAO INFANTIL LTDA;Rua Osmindo Julio Kuhn, 220;Rubem Berta  ; 91180-730 Porto Alegre - RS;Privada;<50;1
5064 EEI RECREIO DA DIVISA;Estr Joao De Oliveira Remiao, 6269;Lomba Do Pinheiro ; 91130-540 Porto Alegre - RS;Privada; 51 e 200;2
YK-ESPACO INFANTIL LTDA;Rua Doutor Prudente De Moraes, 431;Chacara Das Pedras ; 91330-170 Porto Alegre - RS;Privada;<50;1
CRECHE RECANTO DA CRIANCA;Rua Costa Rica, 238;Jardim Lindoia   ; 91050-210 Porto Alegre - RS;Privada; 51 e 200;2
EEI BISPO ISAAC RODRIGUES ACO -CACIM;Avenida Protasio Alves, 0;Petropolis   ; 91310-002 Porto Alegre - RS;Privada;<50;1
5034 IEI ALAN BOM JESUS;R Panama, 324;Bom Jesus  ; 91420-200 Porto Alegre - RS;Privada; 51 e 200;2
EEI FAVINHO DE MEL;Avenida La Paz, 68;Jardim Lindoia   ; 91050-040 Porto Alegre - RS;Privada; 51 e 200;2
CRECHE CIRCO DA FOLIA LTDA;Avenida Elias Cirne Lima, 439; Partenon   ; 91530-310 Porto Alegre - RS;Privada;<50;1
CENTRO INFANTIL SER CRIANCA LTDA;Rua Felipe De Oliveira, 1309;Petropolis   ; 90630-000 Porto Alegre - RS;Privada; 51 e 200;2
ESCOLA DE EDUCACAO INFANTIL CARACOL LTDA;Rua Engenheiro Afonso Cavalcanti, 51;Bela Vista  ; 90440-110 Porto Alegre - RS;Privada; 51 e 200;2
EMEF CHAPEU DO SOL;R Gomercindo De Oliveira, 115;Chapeu Do Sol ; 91787-034 Porto Alegre - RS;Municipal;>1000;5
ALGODAO DOCE EDUCACAO INFANTIL;Rua Artur Fabiao Carneiro, 10;Passo Da Areia ; 91340-030 Porto Alegre - RS;Privada;<50;1
LAR DA PEQUENA CRIANCA;Mae Apolinaria Mathias Batista, 259;Protasio Alves  ; 91450-500 Porto Alegre - RS;Privada;<50;1
CENTRO INFANTIL RECANTO FELIZ-LTDA;Rua Marques Do Pombal, 1077;Moinhos De Vento ; 90540-001 Porto Alegre - RS;Privada;<50;1
5044 EEI CASA DO PEQUENINO;Av Azenha, 366;Azenha   ; 90160-004 Porto Alegre - RS;Privada; 51 e 200;2
ESCOLA DE EDUCACAO INFANTIL CANTINHO DO PIMPOLHO;Rua Nisia Floresta, 270; Restinga   ; 91790-440 Porto Alegre - RS;Privada;<50;1
ESCOLA REI ARTHUR;Rua Luiz Afonso, 565;Cidade Baixa  ; 90050-310 Porto Alegre - RS;Privada;<50;1
CRECHE ESTRELINHA MAGICA;Rua Tarcila Moraes Dutra, 135;Rubem Berta  ; 91170-170 Porto Alegre - RS;Privada;<50;1
ESCOLA DE EDUCACAO INFANTIL MOLEQUE TRAVESSO;Rua General Gomes Carneiro, 287;Medianeira   ; 90870-310 Porto Alegre - RS;Privada;<50;1
5065 IEI ARCO IRIS ENCANTADO;R Guaiba-Lomba Do Pinheiro, 95;Lomba Do Pinheiro ; 91560-640 Porto Alegre - RS;Privada; 51 e 200;2
5091 IEI MADRE BRIGIDA POSTORINO;Bc Flores Vila Tronco Ii, 346;Santa Tereza  ; 90843-462 Porto Alegre - RS;Privada;<50;1
5075 IEI MARIA DOLABELLA PORTELA;R Dona Otilia, 927;Santa Tereza  ; 90830-580 Porto Alegre - RS;Privada; 51 e 200;2
5016 IEI OSICOM I;R Josefa Barreto, 302;Passo Das Pedras ; 91230-080 Porto Alegre - RS;Privada; 51 e 200;2
5067 IEI NOSSA SENHORA DA GLORIA;Claudionor De Morais, 252;Cascata   ; 91710-150 Porto Alegre - RS;Privada; 51 e 200;2
5157 EEI MARISTA RENASCER;R Irmaos Maristas, 1;Mario Quintana  ; 91250-254 Porto Alegre - RS;Privada; 51 e 200;2
5057 EEI CAMPO DA TUCA;Rua D, 200;Partenon   ; 91510-480 Porto Alegre - RS;Privada; 51 e 200;2
5028 EEI SAO VICENTE DE PAULO;R Pedro Raupp, 160;Jardim Itu  ; 91225-080 Porto Alegre - RS;Privada; 51 e 200;2
5204 EEI CRECHE ELSINHA;R Marciano Ribeiro, 83;Medianeira   ; 90870-360 Porto Alegre - RS;Privada; 51 e 200;2
INFANCIAS ESCOLA DE EDUCACAO INFANTIL LTDA;Rua Coronel Fernando Machado, 546;Centro Historico  ; 90010-320 Porto Alegre - RS;Privada;<50;1
CENTRO DE EDUCACAO INFANTIL PROJETO VIDA;Rua Costa Rica, 344;Jardim Lindoia  ; 91050-210 Porto Alegre - RS;Privada;<50;1
ESCOLA DE EDUCACAO INFANTIL MEUS BAIXINHOS;Rua Doutor Pereira Neto, 1077;Tristeza   ; 91920-530 Porto Alegre - RS;Privada;<50;1
JARD D INFANCIA LALILU LETRASIN LTDA EPP;Rua Honorio Silveira Dias, 787;Sao Joao  ; 90550-150 Porto Alegre - RS;Privada; 51 e 200;2
MUNDO DO ABC;Avenida Iguassu, 321;Petropolis   ; 90470-430 Porto Alegre - RS;Privada;<50;1
ESCOLA DE EDUCACAO INFANTIL CORUJINHA SAPECA LTDA;Rua Sao Lucas, 139;Bom Jesus  ; 91420-540 Porto Alegre - RS;Privada;<50;1
CRECHE VOVO OLMIRA LTDA ME;Rua Roque Gonzales, 7;Jardim Botanico  ; 90690-270 Porto Alegre - RS;Privada;<50;1
CENTRO INFANTIL FABRICA DOS SONHOS LTDA;Rua Barbedo, 436;Menino Deus  ; 90110-260 Porto Alegre - RS;Privada;<50;1
ESCOLA DE EDUCACAO INFANTIL RECANTO DO PIA LTDA;Rua Arroio Grande, 253;Cavalhada   ; 91740-180 Porto Alegre - RS;Privada;<50;1
5088 IEI VINDE A MIM AS CRIANCINHAS;Estr Costa Gama, 719;Belem Velho  ; 91787-311 Porto Alegre - RS;Privada; 51 e 200;2
ESCOLA DE EDUCACAO INFANTIL CORACAO MAGICO;Avenida Toledo Piza, 1107;Sarandi   ; 91120-300 Porto Alegre - RS;Privada;<50;1
ESCOLA INFANTIL BICHO CARPINTEIRO-2M LTDA;Rua Doutor Campos Velho, 1400;Cristal   ; 90820-000 Porto Alegre - RS;Privada;<50;1
CREARE CULTURA RECREACAO ARTES E EDUCACAO;Rua Doutor Pereira Neto, 440;Tristeza   ; 91920-530 Porto Alegre - RS;Privada; 51 e 200;2
5109 EEI ANANDA MARGA RESTINGA NOVA 1;Rua Alameda D, 84;Restinga   ; 91790-610 Porto Alegre - RS;Privada;<50;1
5009 IEI SANTA CATARINA;R Josue De Castro, 290;Sarandi   ; 91120-110 Porto Alegre - RS;Privada; 51 e 200;2
5111 EEI ANANDA MARGA BARRO VERMELHO;R Jose De Abreu Fraga, 52;Restinga   ; 91790-095 Porto Alegre - RS;Privada; 51 e 200;2
5083 EEI CASA DE NAZARE CENTRO DE APOIO AO MENOR;R Cel Timoteo, 350;Camaqua   ; 91910-680 Porto Alegre - RS;Privada; 51 e 200;2
5121 IEI NSA SRA APARECIDA IPANEMA;Av Tramandai, 395;Ipanema   ; 91760-050 Porto Alegre - RS;Privada; 51 e 200;2
5132 EEI ANANDA MARGA RESTINGA NOVA 2;Acesso O, 2051; Restinga   ; 91792-260 Porto Alegre - RS;Privada; 51 e 200;2
EEI GIRAFINHA TRAVESSA;Rua Da Republica, 384;Cidade Baixa   ; 90050-320 Porto Alegre - RS;Privada; 51 e 200;2
ESCOLA INFANTIL FAZENDO E ACONTECENDO;Rua Sargento Nicolau Dias De Farias, 568;Tristeza   ; 91900-250 Porto Alegre - RS;Privada; 51 e 200;2
5114 EEI CAPELA NAVEGANTES;Av Guaiba, 3955;Cristal   ; 91900-420 Porto Alegre - RS;Privada;<50;1
CRECHE HAPPY BABY AND KIDS;Rua Visconde Do Rio Branco, 321;Floresta   ; 90570-140 Porto Alegre - RS;Privada;<50;1
CRECHE DESCOBRINDO O MUNDO;Avenida Bastian, 126;Menino Deus  ; 90130-020 Porto Alegre - RS;Privada; 51 e 200;2
CENTRO INFANTIL CONSTRUINDO;Rua Portugal, 266;Sao Joao  ; 90520-310 Porto Alegre - RS;Privada;<50;1
CENTRO INFANTIL TURMA DO GIZ DE CERA;Rua Sofia Veloso, 179;Cidade Baixa  ; 90050-140 Porto Alegre - RS;Privada;<50;1
ESCOLA DE EDUCACAO INFANTIL VOANDO ALTO;Rua Doutor Pereira Neto, 2011;Tristeza   ; 91920-530 Porto Alegre - RS;Privada; 51 e 200;2
5105 EEI ANANDA MARGA RESTINGA VELHA;R Manoel Faria Da Rosa Primo, 779;Restinga   ; 91790-770 Porto Alegre - RS;Privada; 51 e 200;2
5087 IEI NUCLEO SAO FRANCISCO;Bc Um Rua Cel Timoteo, 465;Cavalhada   ; 91910-000 Porto Alegre - RS;Privada; 51 e 200;2
5018 IEI ESPERANCA CORDEIRO;R Julio Stregue, 55;Costa E Silva ; 91180-030 Porto Alegre - RS;Privada; 51 e 200;2
CRECHE BANZE - BEATRIZ REGINA BIFFI;Rua Enfermeiro Ventura, 200;Vila Nova  ; 91750-320 Porto Alegre - RS;Privada;<50;1
EEI LARANJINHA DO CEU;Rua Baden Powell, 168;Sarandi   ; 91110-040 Porto Alegre - RS;Privada;<50;1
EEI PEDACINHO DO CEU SOC SIMPLES;Rua Tapajos, 149;Jardim Sao Pedro ; 91040-410 Porto Alegre - RS;Privada;<50;1
EEI ESTACAO DA FELICIDADE;Rua Washington Luiz, 548;Centro Historico  ; 90010-460 Porto Alegre - RS;Privada;<50;1
ESCOLA DE EDUCACAO INFANTIL VOVO MARGARIDA LTDA;Avenida Teresopolis, 3611;Teresopolis   ; 90870-001 Porto Alegre - RS;Privada;<50;1
5110 EEI ANANDA MARGA JUCA BATISTA;Av Juca Batista, 6841;Ipanema   ; 91770-001 Porto Alegre - RS;Privada; 51 e 200;2
EEI ARTE E MANHA;Avenida Da Cavalhada, 1977;Cavalhada   ; 91740-001 Porto Alegre - RS;Privada;<50;1
5008 EEI JOANA DARC;R Vinte Quatro De Agosto Vl Minuano, 375;Sarandi   ; 91110-560 Porto Alegre - RS;Privada; 51 e 200;2
5036 EEI MUNDO CRIANCA;Rua 4, 62;Morro Santana  ; 91450-430 Porto Alegre - RS;Privada; 51 e 200;2
5006 EEI TRENZINHO DA ALEGRIA;R Senhor Do Bom Fim, 956;Sarandi   ; 91140-380 Porto Alegre - RS;Privada;<50;1
5043 IEI LUPICINIO RODRIGUES;R Almirante Alvaro A Da Motta E Silva, 200;Menino Deus  ; 90160-130 Porto Alegre - RS;Privada; 51 e 200;2
5005 IEI VILA UNIAO;Av Vinte Um De Abril, 1470;Sarandi   ; 91120-630 Porto Alegre - RS;Privada; 51 e 200;2
5102 IEI RENASCER VILA AMERICA;R Roberto Felix Bertoi, 25;Camaqua   ; 91910-540 Porto Alegre - RS;Privada; 51 e 200;2
EMEF TIMBAUVA;R Seis, 0;Mario Quintana  ; 91250-000 Porto Alegre - RS;Municipal; 501 e 1000;4
ESCOLA DE EDUCACAO INFANTIL FLORESTINHA - HIPICA;Rua Baldoino Bottini, 197;Hipica   ; 91787-775 Porto Alegre - RS;Privada;<50;1
ESCOLA SEMEANDO CARINHO;Rua Alvaro Pedro Da Rosa, 250;Hipica   ; 91755-190 Porto Alegre - RS;Privada;<50;1
EEI TERRITORIOS DO APRENDER;Rua Umbu, 219;Passo Da Areia ; 91350-100 Porto Alegre - RS;Privada;<50;1
5040 IEI SAGRADA FAMILIA;Rua 05 V. Laranjeiras, 174;Morro Santana   ; 174 MORRO SANTANA 91310-001 Porto Alegre - RS;Privada; 51 e 200;2
5052 EEI SAO PEDRO;Rua Padre Roque Gonzales, 315;Lomba Do Pinheiro   ; 91570-170 Porto Alegre - RS;Privada;<50;1
5084 EEI CANTINHO DA CRIANCA;Rua Adao Araujo, 81;Coronel Aparicio Borges; 91710-560 Porto Alegre - RS;Privada; 51 e 200;2
BOLA E BAMBOLE LTDA;Rua Vicente Da Fontoura, 885;Rio Branco  ; 90640-001 Porto Alegre - RS;Privada;<50;1
5045 EEI SOMAI;R Bom Jesus, 610;Bom Jesus  ; 91420-030 Porto Alegre - RS;Privada; 51 e 200;2
5071 EEI CRIANCA FELIZ;R Canudos, 625;Cascata   ; 91712-340 Porto Alegre - RS;Privada; 51 e 200;2
EEI CILIKA;Rua Chico Pedro, 308;Cristal   ; 91910-530 Porto Alegre - RS;Privada;<50;1
CRECHE BALAO VERMELHO;Rua Barao De Cerro Largo, 93;Menino Deus  ; 90850-110 Porto Alegre - RS;Privada;<50;1
CLUBINHO DA CRIANCA - BERENICE AMORIM DE AMORIM -ME;Rua Ledo Guimaraes Mariante, 235;Protasio Alves  ; 91250-190 Porto Alegre - RS;Privada;<50;1
5060 IEI MURIALDO;Travessa Sao Joao, 57;Vila Sao Jose ; 91520-560 Porto Alegre - RS;Privada; 51 e 200;2
5031 IEI TIA ROSA;R Cinco Vila Valneri Antunes, 10;Mario Quintana  ; 91260-350 Porto Alegre - RS;Privada; 51 e 200;2
PRE-ESCOLA PARAISO DOS BAIXINHO;Avenida Da Cavalhada, 5210;Cavalhada   ; 91751-831 Porto Alegre - RS;Privada;<50;1
5033 IEI ALAN MARIA TEREZA;Av Dez De Maio, 265;Passo Das Pedras ; 91230-480 Porto Alegre - RS;Privada; 51 e 200;2
5050 EEI NSA SRA APARECIDA SAO PEDRO;Av Ipiranga, 5229;Praia De Belas   ; 90160-092 Porto Alegre - RS;Privada; 51 e 200;2
5073 EEI MATO GROSSO;Rua Octavio De Souza, 1818;Teresopolis   ; 90840-350 Porto Alegre - RS;Privada; 51 e 200;2
BERCARIO CRECHE E RECREACAO NENECA;Rua Faria Santos, 248;Petropolis   ; 90670-100 Porto Alegre - RS;Privada;<50;1
5112 EEI SANTA CATARINA DA RESTINGA;Av Luiz Francisco Zanella, 1001;Restinga   ; 91790-800 Porto Alegre - RS;Privada; 51 e 200;2
5002 IEI JOAO PAULO II;R Frederico Mentz, 118;Farrapos   ; 90250-370 Porto Alegre - RS;Privada; 51 e 200;2
5001 IEI MAEZINHA DO CEU;R Vinte Cinco De Outubro, 295;Sarandi   ; 91140-500 Porto Alegre - RS;Privada; 51 e 200;2
5081 EEI BRIZOLINHA;Av Arroio Dos Padres, 130;Cascata   ; 91712-390 Porto Alegre - RS;Privada;<50;1
CRECHE E RECREACAO LAGO DO CISNE LTDA;Rua Comendador Rodolfo Gomes, 263;Menino Deus  ; 90150-101 Porto Alegre - RS;Privada;<50;1
5106 EEI NOVA SANTA RITA;R Tobago, 570;Restinga   ; 91790-530 Porto Alegre - RS;Privada; 51 e 200;2
5074 IEI BOA ESPERANCA;Rua Osmar Santos Freitas, 40;Santa Tereza  ; 90840-405 Porto Alegre - RS;Privada; 51 e 200;2
5117 EEI NOSSA SENHORA APARECIDA LOT MARIANTE;R Honduras, 19;Belem Velho  ; 91787-302 Porto Alegre - RS;Privada; 51 e 200;2
5077 EEI NOSSA SENHORA DE NAZARE-DOM ORIONE;R Euclides De Almeida, 20;Santa Tereza  ; 90840-640 Porto Alegre - RS;Privada; 51 e 200;2
5116 IEI COLORINDO MEU DIA;R Jose Luiz Martins Costa, 1001;Mario Quintana  ; 91250-330 Porto Alegre - RS;Privada; 51 e 200;2
5076 EEI DOM ORIONE;R Ursa Maior, 215;Cristal   ; 90820-200 Porto Alegre - RS;Privada; 51 e 200;2
5010 IEI ACOMPAR NUCLEO II - SANTO AGOSTINHO;Av Caldeia, 210;Sarandi   ; 91130-540 Porto Alegre - RS;Privada; 51 e 200;2
ESCOLA DE EDUCACAO INFANTIL AQUI EU FICO;Rua Eca De Queiroz, 129; Petropolis   ; 90670-020 Porto Alegre - RS;Privada; 51 e 200;2
5023 EEI VO ANA;R Jose Luiz Martins Costa, 200;Mario Quintana  ; 91250-330 Porto Alegre - RS;Privada; 51 e 200;2
5085 EEI BATILANOS;Estr Batillanas, 1005;Cascata   ; 91712-310 Porto Alegre - RS;Privada;<50;1
5032 IEI JERUSALEM BEITH SHALOM;Av Vitoria, 35;Passo Das Pedras ; 91225-040 Porto Alegre - RS;Privada; 51 e 200;2
5113 EEI ANJINHO DA GUARDA;R Domingos De Abreu, 290;Sarandi   ; 91120-090 Porto Alegre - RS;Privada; 51 e 200;2
5012 EEI JESUS O BOM PASTOR;R Dona Teodora, 160;Farrapos   ; 90240-300 Porto Alegre - RS;Privada; 51 e 200;2
5046 IEI NSA SRA DE FATIMA NOVO MUNDO;Av Martim Felix Berta, 2575;Rubem Berta  ; 91270-650 Porto Alegre - RS;Privada; 51 e 200;2
5115 IEI SANTA ANITA;R Menezes Paredes, 425;Nonoai   ; 90830-070 Porto Alegre - RS;Privada; 51 e 200;2
ESCOLA DE EDUCACAO INFANTIL BICHINHO DA GOIABA;Rua Jenor Cardoso Jarros, 235;Jardim Itu Sabara ; 91215-200 Porto Alegre - RS;Privada;<50;1
REINO DA FANTASIA CENTRO DE CRIATIVIDADE E RECREAC;Avenida Valado, 401;Vila Joao Pessoa ; 91510-740 Porto Alegre - RS;Privada;<50;1
ESCOLA DE EDUCACAO INFANTIL ESPACO BRINCAR;Rua Adao Baino, 542;Cristo Redentor  ; 91350-240 Porto Alegre - RS;Privada;<50;1
EEI CENTRO ADM FERNANDO FERRARI;Avenida Borges De Medeiros, 1501;Praia De Belas ; 90119-900 Porto Alegre - RS;Estadual; 51 e 200;2
ESCOLA INFANTIL VIVER E CONVIVER;Rua Gomes Jardim, 506;Santana   ; 90620-130 Porto Alegre - RS;Privada;<50;1
ESCOLA DE EDUCACAO INFANTIL CICLA;Rua Machado De Assis, 945;Partenon   ; 90620-260 Porto Alegre - RS;Privada;<50;1
INSTITUICAO DE EDUCACAO INFANTIL GATINHO TRAVESSO;Rua Coronel Corte Real, 246;Petropolis   ; 90630-080 Porto Alegre - RS;Privada;<50;1
EEI ARQUITETO BATISTTINO ANELE-DAER;Avenida Borges De Medeiros, 1555;Praia De Belas   ; 90110-150 Porto Alegre - RS;Estadual; 51 e 200;2
ESCOLA DE EDUCACAO INFANTIL REINO DOS BAIXINHOS;Av Protasio Alves, 8383;Morro Santana  ; 91310-010 Porto Alegre - RS;Privada;<50;1
CRECHE WERNER SCHWUCHOW;Rua Ramiro Barcelos, 910;Floresta   ; 90035-001 Porto Alegre - RS;Privada; 51 e 200;2
BABY E CIA;Avenida Nonoai, 205;Nonoai   ; 91720-000 Porto Alegre - RS;Privada;<50;1
EEI GIRASSOL DO APRENDER;Avenida Clemenciano Barnasque, 460;Teresopolis   ; 91720-260 Porto Alegre - RS;Privada;<50;1
ESCOLA DE EDUCACAO INFANTIL ARTE BABY LTDA;Rua Ariovaldo Pinheiro, 84;Passo Da Areia ; 91350-120 Porto Alegre - RS;Privada;<50;1
